{"schemaVersion":"1.3.0","adjudicationSchemaVersion":"1.0.0","feedbackSchemaVersion":"1.3.0","distributionVersion":"1.3.0-curator.1","workbenchReleaseId":"ohri-mouse-interneuron-public-data-workbench-1.3.0","maximumPacketBytes":2097152,"minimumIndependentCurators":2,"permittedDispositions":["defer_pending_evidence","return_for_revision","recommend_next_private_review"],"privacy":"Created locally; not uploaded.","readOnlyPacketImport":true,"boundary":"An adjudication packet compares independent local feedback records. It cannot change evidence, acquire data, authorize public deployment, establish biological truth, or create a registration. Packet import is read-only and does not certify the original ZIP digest."}
